{"$schema":"https://json-schema.org/draft/2020-12/schema","$id":"https://boi.app/schema/chat_reply.v1.json","title":"Licensed chat reply v1","type":"object","additionalProperties":false,"required":["schema_version","kind","text","synced_through","licenses"],"properties":{"schema_version":{"const":"chat_reply.v1"},"kind":{"enum":["answer","decline"]},"text":{"type":"string","minLength":1,"maxLength":1000},"synced_through":{"type":"string","format":"date-time"},"licenses":{"type":"array","maxItems":5,"items":{"type":"object","additionalProperties":false,"required":["contact_id","display","reason"],"properties":{"contact_id":{"type":"string","pattern":"^h_[0-9a-f]{8,32}$"},"display":{"type":"string","maxLength":64},"reason":{"type":"string","maxLength":140}}}},"follow_up_draft":{"$ref":"draft_delivery.v1.json"}}}
